source_data,batch_id,major_job_id,priority
ಇತ್ತೀಚೆಗೆ ಪ್ರವಾಹದಿಂದ ಹಾನಿ ಉಂಟಾದ ಪ್ರದೇಶಗಳಿಗೆ ಕೇಂದ್ರ ತಂಡಗಳು ಭೇಟಿ ನೀಡಿ ಪರಿಶೀಲನೆ ನಡೆಸಿದ್ದವು.,384,4,high
೩೧ರವರೆಗೆ ದೆಹಲಿಯ ಎಲ್ಲಾ ಶಾಲಾ-ಕಾಲೇಜುಗಳು ಹಾಗೂ ಚಿತ್ರಮಂದಿರಗಳನ್ನು ಬಂದ್ ಮಾಡಲಾಗಿದೆ ಎಂದು ಸ್ಪಷ್ಟಪಡಿಸಿದ್ದಾರೆ.,385,4,low
"ಸೇವಾ ನಿಯಮಗಳ ಪ್ರಕಾರ ಹಿರಿಯ ಪೊಲೀಸ್‌ ಅಧಿಕಾರಿಗಳು ಯಾವುದೇ ಮಾಹಿತಿ ಹೊಂದಿದ್ದರೂ ಅದರ ಬಗ್ಗೆ ಕ್ರಮ ತೆಗೆದುಕೊಳ್ಳಬೇಕು,” ಎಂದಿದ್ದಾರೆ.",385,4,low
"ಈ ಬಗ್ಗೆ ಅಂತಿಮ ನಿರ್ಧಾರ ತೆಗೆದುಕೊಳ್ಳಲಾಗುವುದು,"" ಎಂದು ಸರಕಾರಕ್ಕೆ ಹತ್ತಿರ ಮೂಲಗಳು ಸುದ್ದಿ ಸಂಸ್ಥೆಗೆ ತಿಳಿಸಿವೆ.",385,4,low
ಬಳಿಕ ಮಾಟಗಾತಿಯ ಮಾತು ನಂಬಿ ತನ್ನ ಮಗಳನ್ನು ಕೊಲೆ ಮಾಡಿರುವುದಾಗಿ ಪನೀರ್‌ಸೆಲ್ವಂ ಒಪ್ಪಿಕೊಂಡಿದ್ದಾನೆ.,385,4,low
"ನಿಮಗೂ, ನಿಮ್ಮ ಕುಟುಂಬಕ್ಕೂ ಹೋಳಿ ಹಬ್ಬದ ಹಾರ್ದಿಕ ಶುಭಾಶಯಗಳು* ಬಣ್ಣಗಳ ಹಬ್ಬ ನಿಮ್ಮ ಬಾಳಿನಲ್ಲಿ ಖುಷಿಯ ಚಿತ್ತಾರ ಮೂಡಿಸಲಿ.",385,4,low
"ಆದರೆ, ನೀವು ಈಗ ಉತ್ತಮ ಸ್ಥಳದಲ್ಲಿದ್ದೀರಿ ಮತ್ತು ಎಲ್ಲಾ ದುಃಖ, ನೋವು, ಮೋಸಗಳು, ಸುಳ್ಳುಗಳಿಂದ ಮುಕ್ತರಾಗಿರಿದ್ದೀರಿ ಎಂದು ನನಗೆ ತಿಳಿದಿದೆ.",385,4,low
ಅವುಗಳಲ್ಲಿಇಬ್ಬರು ವ್ಯಕ್ತಿಗಳು ಮೃತಪಟ್ಟಿದ್ದು 44 ಜನ ಗುಣಮುಖರಾಗಿದ್ದು 42 ಸೋಂಕಿನ ಸಕ್ರಿಯ ಪ್ರಕರಣಗಳಿವೆ.,385,4,low
"ಕೇವಲ ಇದು ಮಾತ್ರವಲ್ಲದೆ ಹೀಗೆ ತಯಾರಾದ ಪಾನೀಯದಲ್ಲಿ, ನೀರು, ಖನಿಜಾಂಶಗಳು, ವಿಟಮಿನ್ ಅಂಶಗಳು ಮತ್ತು ಸಣ್ಣ ಪ್ರಮಾಣದ ಆಮ್ಲಗಳು ಲಭ್ಯವಿರುತ್ತವೆ.",385,4,low
"ಜನರು ಸಾಮಾಜಿಕ ಅಂತರ ಕಾಯ್ದುಕೊಂಡು, ಮಾಸ್ಕ್‌ ಹಾಕಿಕೊಳ್ಳುವ ಮೂಲಕ ಕೋವಿಡ್‌ ಮಾರ್ಗಸೂಚಿ ಪಾಲಿಸಬೇಕು.",385,4,low
"ಶನಿವಾರ 90 ಮಂದಿ ಆಸ್ಪತ್ರೆಯಿಂದ ಬಿಡುಗಡೆಗೊಂಡಿದ್ದು, ಈ ಮೂಲಕ ಒಟ್ಟು 2217 ಮಂದಿ ಸೋಂಕಿನಿಂದ ಗುಣಮುಖರಾಗಿ, ಆಸ್ಪತ್ರೆಯಲ್ಲಿ ಬಿಡುಗಡೆಗೊಂಡಿದ್ದಾರೆ.",385,4,low
"ಬೆಳಗ್ಗೆ 10.30ರಿಂದ 1.30ರವರೆಗೆ ಪರೀಕ್ಷೆ ನಡೆಯಲಿದ್ದು, ಒಂದು ಗಂಟೆ ಮೊದಲೇ ವಿದ್ಯಾರ್ಥಿಗಳಿಗೆ ಬರಲು ಅವಕಾಶವಿದೆ.",386,4,low
"ಇಂದಿನವರೆಗೆ 1660 ಜನರು ಸೋಂಕಿನಿಂದ ಗುಣಮುಖರಾಗಿ ಬಿಡುಗಡೆ ಹೊಂದಿದ್ದಾರೆ, 56 ಜನರು ಮೃತಪಟ್ಟಿದ್ದಾರೆ.",386,4,low
ಆರೋಪಿಯ ವಿರುದ್ಧ ಭಾನುವಾರ ಕೇಸ್‌ ದಾಖಲಿಸಿಕೊಂಡು ಸೋಮವಾರ ಬಂಧಿಸಲಾಗಿದೆ ಎಂದು ಪೊಲೀಸರು ತಿಳಿಸಿದ್ದಾರೆ.,386,4,low
"ಕಳೆದ 24 ಗಂಟೆಗಳ ಅವಧಿಯಲ್ಲಿ ರಾಜ್ಯದಲ್ಲಿ ಹೊಸದಾಗಿ 1,152 ಕೋವಿಡ್‌-19 ಪ್ರಕರಣಗಳು ವರದಿಯಾಗಿವೆ.",386,4,low
ವಿದೇಶ ಹಾಗೂ ಹೊರ ರಾಜ್ಯಗಳಿಂದ ಮರಳಿ ಬರುವವರಿಗೆ 14 ದಿನಗಳ ಕ್ವಾರಂಟೈನ್‌ಗೆ ಒಳಪಡಲೇಬೇಕಿದೆ.,386,4,low
ಬರೋಬ್ಬರಿ 13 ಜಿಲ್ಲೆಗಳಲ್ಲಿ 10 ಕ್ಕಿಂತ ಹೆಚ್ಚಿನ ಕೊರೊನಾ ವೈರಸ್‌ ಪ್ರಕರಣಗಳು ವರದಿಯಾಗಿವೆ.,386,4,low
ಈ ಭಾಗದ ಜನರಲ್ಲಿ ಕೌಶಲ್ಯ ಸುಧಾರಿಸಿ ಉತ್ಪಾದನೆ ಮತ್ತು ಸೇವಾ ವಲಯಗಳಲ್ಲಿ ಪರಿಣಾಮಕಾರಿ ಬೆಳವಣಿಗೆ ಸಾಧಿಸುವುದು ಸರ್ಕಾರದ ಗುರಿಯಾಗಿದೆ.,386,4,low
"ಇವರಲ್ಲಿ ಬಹುತೇಕ ಮಂದಿ ಉತ್ತರಪ್ರದೇಶ, ಬಿಹಾರ, ಪಶ್ಚಿಮ ಬಂಗಾಳ, ಒಡಿಶಾ ರಾಜ್ಯಕ್ಕೆ ಸೇರಿದವರು.",386,4,low
ಬಾಲಿವುಡ್ ಸ್ಟಾರ್ ದಂಪತಿಗಳಾದ ಸೈಫ್ ಅಲಿ ಖಾನ್ ಹಾಗೂ ಕರೀನಾ ಕಪೂರ್ ಮಗ ತೈಮೂರ್ ಅವರು ಸಾಕಷ್ಟು ಫೇಮಸ್ ಆಗಿದ್ದಾರೆ.,386,4,low
ಅಂತೆಯೇ ಬಾಲಿವುಡ್ ನಟ ಶಾರುಖ್ ಖಾನ್ ಪುತ್ರಿ ಸುಹಾನಾ ಖಾನ್ ಅವರು ಆಗಾಗ ಕೆಲ ವಿಚಾರಗಳಿಗೆ ಸುದ್ದಿಯಾಗುತ್ತಿರುತ್ತಾರೆ.,386,4,low
ಮುಖ್ಯಮಂತ್ರಿ ಕಮಲ್‌ನಾಥ್‌ ಮಂಗಳವಾರ ಈ ಆರು ಸಚಿವರನ್ನು ವಜಾಗೊಳಿಸುವಂತೆ ರಾಜ್ಯಪಾಲರಿಗೆ ಶಿಫಾರಸ್ಸು ಮಾಡಿದ್ದಾರೆ.,387,4,low
2016ರಲ್ಲಿ ರಾಜ್ಯಸಭೆಗೆ ನಾಮನಿರ್ದೇಶನಕ್ಕಾಗಿ ಸಂಜಯ್ ರವತ್ ಸಲ್ಲಿಸಿದ ಅಫಿಡವಿಟ್ನಲ್ಲಿ 55 ಲಕ್ಷ ರೂ.,387,4,low
"ಮೃತದೇಹವನ್ನು ಮರಣೋತ್ತರ ಪರೀಕ್ಷೆಗೆ ಕಳುಹಿಸಲಾಗಿದ್ದು, ವರದಿ ನಿರೀಕ್ಷಿಸಲಾಗುತ್ತಿದೆ ಎಂದು ಪೊಲೀಸರು ಮೂಲಗಳು ಹೇಳಿವೆ.",387,4,low
"ಮಾರ್ಚ್‌ 21ಕ್ಕೆ ನಾವು ಹಿಂತಿರುಗಿ ನೋಡಿದರೆ, ಮೂರು ದಿನಗಳಲ್ಲಿ ಕೊರೊನಾ ಪ್ರಕರಣಗಳು ದ್ವಿಗುಣಗೊಳ್ಳುತ್ತಿದ್ದವು.",387,4,low
ನಿರ್ದೇಶಕ ಎಪಿ ಅರ್ಜುನ್ ಇಂದು ಅವರ ಸ್ವಗೃಹದಲ್ಲಿ ಅನು (ಅನ್ನಪೂರ್ಣ) ಎಂಬುವವರ ಜೊತೆಗೆ ವೈವಾಹಿಕ ಜೀವನಕ್ಕೆ ಕಾಲಿಟ್ಟಿದ್ದಾರೆ.,387,4,low
ಕೊರೊನಾ ವೈರಸ್ ವಿರುದ್ಧದ ಹೋರಾಟದ ಭಾಗವಾಗಿ ದೇಶವನ್ನು 21 ದಿನಗಳ ಲಾಕ್‌ಡೌನ್ ಸ್ಥಿತಿಯಲ್ಲಿ ಇಡಲಾಗಿದೆ.,387,4,low
130 ನಿಲ್ದಾಣಗಳಲ್ಲಿ ಸಿಬ್ಬಂದಿ ಮತ್ತು ಅಗತ್ಯ ಔಷಧಿಗಳನ್ನು ಒದಗಿಸಲು ಒಪ್ಪಿಕೊಂಡರೆ ಮಾತ್ರ ರಾಜ್ಯಗಳು ಕೊವಿಡ್‍ ಆರೈಕೆ ಬೋಗಿಗಳಿಗಾಗಿ ಮನವಿ ಮಾಡಬಹುದಾಗಿದೆ.,387,4,low
ಕೊವಿಡ್-19 ಲಕ್ಷಣಗಳು ಇದ್ದರೆ ಆಗ ನೀವು ತಕ್ಷಣವೇ ಹೋಗಿ ವೈದ್ಯಕೀಯ ನೆರವು ಪಡೆಯಿರಿ.,387,4,low
"ಸಿನಿಮಾ ಹಾಲ್‌ಗಳು, ಜಿಮ್‌, ಈಜುಕೊಳಗಳು, ಮನಜರಂಜನಾ ಉದ್ಯಾನವನ, ಚಿತ್ರಮಂದಿರ, ಬಾರ್‌, ಸಭಾಂಗಣ, ಅಸೆಂಬ್ಲಿಹಾಲ್‌ಗಳು ಮತ್ತು ಅಂತಹುದೇ ಸ್ಥಳಗಳಲ್ಲಿನಡೆಯುವ ಚಟುವಟಿಕೆಗಳನ್ನು ನಿರ್ಬಂಧಿಸಲಾಗಿದೆ.",387,4,low
ಆದರೆ ಲಾಕ್‌ಡೌನ್ ಪರಿಣಾಮದಿಂದ ಆರೋಗ್ಯ ಇಲಾಖೆಯ ವರದಿಗಳ ಪ್ರಕಾರ 3.32 ಲಕ್ಷ ಪ್ರಕರಣಗಳು ಮಾತ್ರ ದಾಖಲಾಗಿದ್ದವು.,387,4,low
﻿ಹತ್ರಾಸ್‌ ಅತ್ಯಾಚಾರ ಆರೋಪಿಗಳಿಗೆ 'ನ್ಯಾಯ' ಕೋರಿ ಮೇಲ್ಜಾತಿ ಪುರುಷರ ಸಭೆ ನಡೆಸಿದ ಬಿಜೆಪಿ ಮಾಜಿ ಶಾಸಕ. . !,388,4,low
ಸುಮಾರು ಆರು ಮನೆಗಳಿರುವ ಏರಿಯಾವನ್ನು ಸೀಲ್‌ ಮಾಡಲಾಗಿದ್ದು ಇಲ್ಲಿ 30ಕ್ಕೂ ಹೆಚ್ಚು ಮಂದಿ ವಾಸವಿದ್ದಾರೆ.,388,4,low
"ತೆಲುಗು, ಹಿಂದಿ, ಕನ್ನಡ, ಮಲಯಾಳಂ, ತಮಿಳು ಸೇರಿದಂತೆ ಅನೇಕ ಭಾಷೆಗಳಲ್ಲಿ ಈ ಚಿತ್ರ ರಿಲೀಸ್ ಆಗಲಿದೆ.",388,4,low
ಬೆಂಗಳೂರು ನಗರದ ಜನಸಂಖ್ಯೆ 1.2 ಕೋಟಿ ಮೀರಿದ್ದು ಪ್ರತಿ ದಿನ 5800 ಮೆಟ್ರಿಕ್ ಟನ್ ತ್ಯಾಜ್ಯ ಉತ್ಪಾದನೆ ಆಗುತ್ತಿದೆ.,388,4,low
ಈ ಹಿಂದೆ ಎಸ್‌ಟಿಆರ್ ಇತಿಹಾಸದಲ್ಲೇ 2018ನೇ ಇಸವಿಯಲ್ಲಿ ತ್ರಿವಳಿ ಮರಿಗಳಿಗೆ ಜನ್ಮ ನೀಡಿ ಹೆಣ್ಣು ಹುಲಿ ದಾಖಲೆಯನ್ನು ನಿರ್ಮಿಸಿತ್ತು.,388,4,low
"ನಮ್ಮ ತಂಡದ ಸದಸ್ಯರ ಸುರಕ್ಷತೆ ಮತ್ತು ಯೋಗಕ್ಷೇಮ ಯಾವಾಗಲೂ ನಮ್ಮ ಆದ್ಯತೆಯಾಗಿದೆ,"" ಎಂದು ಅವರು ಹೇಳಿಕೆಯಲ್ಲಿ ತಿಳಿಸಿದ್ದಾರೆ.",388,4,low
"ಇಂದು ಬೆಳಿಗ್ಗೆ 7 ಗಂಟೆಯಿಂದಲೇ ಮತದಾನ ಪ್ರಕ್ರಿಯೆ ಆರಂಭಗೊಂಡಿದ್ದು, ಸಂಜೆ 6 ಗಂಟೆಗೆ ಮುಕ್ತಾಯವಾಗಲಿದೆ.",388,4,low
ಮಕ್ಕಳ ಪೈಕಿ ನಾಲ್ವರ ಮೇಲೆ ಲೈಂಗಿಕ ದೌರ್ಜನ್ಯ ನಡೆದಿರುವುದು ವೈದ್ಯಕೀಯ ಪರೀಕ್ಷೆಯಲ್ಲಿ ತಿಳಿದುಬಂದಿದೆ.,388,4,low
ನಂತರ ಉನ್ನತ ಮಟ್ಟದಲ್ಲಿ ಈ ಬಗ್ಗೆ ತೀರ್ಮಾನ ತೆಗೆದುಕೊಳ್ಳಲಾಗುತ್ತದೆ ಎಂಬುದಾಗಿ ಅಧಿಕಾರಿಯೊಬ್ಬರು ಹೇಳಿದ್ದಾರೆ.,388,4,low
ಉಳಿದಂತೆ ಪ್ರಾಥಮಿಕ ಆರೋಗ್ಯ ಕೇಂದ್ರಗಳ ಕಾರ್ಯಾವಧಿಯನ್ನು ಕೂಡ ಸಂಜೆ 6 ಗಂಟೆವರೆಗೆ ವಿಸ್ತರಿಸಲಾಗಿದೆ.,388,4,low
"ಇದರಲ್ಲಿ ಕಾಸರಗೋಡು ಜಿಲ್ಲೆಯಲ್ಲಿ ನಾಲ್ವರಿಗೆ, ಕಣ್ಣೂರು ಜಿಲ್ಲೆಯಲ್ಲಿ ಮೂವರು, ಕೊಲ್ಲಂ, ಮಲಪ್ಪುರ ಜಿಲ್ಲೆಯಲ್ಲಿ ತಲಾ ಒಂದು ರೋಗ ದೃಢಪಟ್ಟಿದೆ.",389,4,low
ಬೆಳಿಗ್ಗೆ 9 ರಿಂದ ಸಂಜೆ 7 ಗಂಟೆ ವರೆಗೆ ವೈನ್‌ ಶಾಪ್‌ಗಳು ತೆರೆದಿರಲಿವೆ.,389,4,low
ಬೆಳಗ್ಗೆ 7 ಗಂಟೆಗೆ ಮತದಾನ ಆರಂಭಗೊಂಡಿದ್ದು ಸಂಜೆ 6 ಗಂಟೆಯವರೆಗೂ ಮತದಾನ ಮಾಡಲು ಅವಕಾಶವಿದೆ.,389,4,low
ಘಟನಾ ಸ್ಥಳದ ಸುತ್ತಮುತ್ತ ಅಳವಡಿಸಿರುವ ಸಿಸಿ ಕ್ಯಾಮೆರಾಗಳ ಪರಿಶೀಲನೆ ನಡೆಸಿರುವ ಪೊಲೀಸರು ದುಷ್ಕರ್ಮಿಗಳ ಪತ್ತೆಗೆ ಮುಂದಾಗಿದ್ದಾರೆ.,389,4,low
ದೊಡ್ಡ ಪ್ರಮಾಣದ ಹಗರಣಗಳು ಮತ್ತು ಭ್ರಷ್ಟಾಚಾರದ ಬಗ್ಗೆ ಮುಖ್ಯಮಂತ್ರಿಗಳಿಗೆ ತಿಳಿದಿಲ್ಲ ಎಂಬುದು ಹೇಗೆ ಸಾಧ್ಯ?,389,4,low
"ಈ ನಡುವೆ, ಮುಂಬೈ ಪೊಲೀಸರು ರಿಪಬ್ಲಿಕ್ ಟಿವಿಯ ಕೆಲವು ಹೂಡಿಕೆದಾರರ ಹೇಳಿಕೆ ದಾಖಲಿಸಿಕೊಳ್ಳಲು ಅಕ್ಟೋಬರ್ 30ರಂದು ಬರುವಂತೆ ಹೇಳಿದೆ.",389,4,low
"ಆದರೂ ಈವರೆಗೂ ಪೊಲೀಸರು ಪ್ರಕರಣ ದಾಖಲಿಸಿ, ಯಾರೊಬ್ಬರನ್ನೂ ಬಂಧಿಸಿಲ್ಲ ಎಂದು ಕಿಡಿ ಕಾರಿದರು.",389,4,low
"ಸುಶಾಂತ್‌ ಸಿಂಗ್‌ ರಜಪೂತ್‌ ಅವರ ಕುಟುಂಬದವರಿಗೆ ನನ್ನ ಸಂತಾಪಗಳು,"" ಎಂದು ಟ್ವೀಟ್‌ ಮಾಡಿದ್ದಾರೆ.",389,4,low
ವೈದ್ಯರ ಪ್ರತಿಭಟನೆಈ ಘಟನೆ ಖಂಡಿಸಿ ವೈದ್ಯರು ಹಾಗೂ ಸಿಬ್ಬಂದಿ ಪ್ರತಿಭಟನೆ ನಡೆಸಿ ಆಕ್ರೋಶ ವ್ಯಕ್ತಪಡಿಸಿದರು.,389,4,low
17. ಲಕ್ಷ್ಮಿ ದೇವತೆ ಮತ್ತು ಭಗವಾನ್‌ ಗಣೇಶನು ನಿಮ್ಮ ಮತ್ತು ನಿಮ್ಮ ಕುಟುಂಬದ ಮೇಲೆ ತಮ್ಮ ಆಶೀರ್ವಾದದ ಹೂವನ್ನು ಸುರಿಸಲಿ.,389,4,low
ಕೋವಿಡ್ 19 ರೋಗಿಗಳನ್ನು ಮತ್ತವರ ಕುಟುಂಬವನ್ನು ಹೇಗೆ ಬೆಂಬಲಿಸಬಹುದು ಎಂಬುದರ ಬಗ್ಗೆ ಗಮನ ವಹಿಸಬೇಕು.,390,4,low
"ಕಳೆದ ಮೂರು ವರ್ಷಗಳ ಹಿಂದೆಯೇ ವಿವಾಹವಾಗಿದ್ದು, ಮೃತನಿಗೆ ಪತ್ನಿ ಹಾಗೂ ಒಂದು ವರ್ಷದ ಹೆಣ್ಣು ಮಗುವಿದೆ.",390,4,low
"ಭಾರತದಲ್ಲಿ ಸ್ವಾತಂತ್ರ್ಯ, ಅಭಿವೃದ್ಧಿ, ಸಾಮರಸ್ಯ ಮತ್ತು ಶಾಂತಿಯ ಸಂದೇಶವನ್ನು ಹೇಳಿ ಯುವಕರನ್ನು ಆಕರ್ಷಿಸಿದರು.",390,4,low
"ಜತೆಗೆ ಆಂಡ್ರಾಯ್ಡ್ 10 ಆಧರಿತ ಒನ್‌ಯುಐ ಓಎಸ್ ಇದ್ದು, 3,300mAh ಬ್ಯಾಟರಿ ಬೆಂಬಲ ಹೊಂದಿದೆ.",390,4,low
ಇನ್ನು ವೈರಸ್‌ ಬಗ್ಗೆ ಸುಳ್ಳು ಸುದ್ದಿ ಹರಡುವವರ ವಿರುದ್ಧ ಕಠಿಣ ಕ್ರಮ ಕೈಗೊಳ್ಳುವ ಎಚ್ಚರಿಕೆ ನೀಡಿದ್ದಾರೆ.,390,4,low
ಒಂದು ಜೊತೆ ಜೀನ್ಸ್ ಪ್ರತಿಯೊಬ್ಬ ಮಹಿಳೆಯ ವಾರ್ಡ್ ರೋಬ್ ನ ಅಗತ್ಯ ಉಡುಗೆಯಾಗಿದೆ.,390,4,low
"* ಸಾರ್ವಜನಿಕ, ರಾಜಕೀಯ, ಶೈಕ್ಷಣಿಕ, ಸಾಂಸ್ಕೃತಿಕ, ಕ್ರೀಡೆ, ಮನರಂಜನೆ, ಧಾರ್ಮಿಕ ಸಭೆ ಸಮಾರಂಭಗಳಿಗೆ ಅವಕಾಶವಿಲ್ಲ.",390,4,low
ರಾಮ ಜನ್ಮಭೂಮಿ ಹಾಗೂ ಬಾಬ್ರಿ ಮಸೀದಿ ಪ್ರಕರಣದಲ್ಲಿ ಇಕ್ಬಾಲ್ ಅನ್ಸಾರಿ ಅವರ ತಂದೆ ಹಶೀಮ್ ಅನ್ಸಾರಿ ಮೊದಲ ಮುಸ್ಲಿಂ ದಾವೆದಾರರಾಗಿದ್ದರು.,390,4,low
ಈ ಹೊಡೆತಕ್ಕೆ ಇಬ್ಬರೂ ಸ್ಥಳದಲ್ಲೇ ಸಾವಿಗೀಡಾದರು ಎಂದು ಮಡಗಾಂವ್‌ ಪೊಲೀಸರು ಮಾಹಿತಿ ನೀಡಿದ್ದಾರೆ.,390,4,low
"ಈ ವೇಳೆ ಪ್ರಧಾನಿ ಮೋದಿ, ರಾಷ್ಟ್ರಪತಿ ರಾಮನಾಥ್ ಕೋವಿಂದ್ ಸೇರಿದಂತೆ ಹಲವು ಗಣ್ಯರು ಅಂತಿಮ ದರ್ಶನ ಪಡೆದರು.",390,4,low
ನಟ ಸುಶಾಂತ್ ಸಿಂಗ್ ರಜಪೂತ್ ಅವರ ಅಕಾಲಿಕ ಸಾವು ಸಿನಿಪ್ರಿಯರಿಗೆ ಶಾಕ್‌ ನೀಡಿದೆ.,391,4,medium
"ಶನಿವಾರ ಒಂದೇ ದಿನ 103 ಮಂದಿ ಸೋಂಕಿತರು ಗುಣವಾಗಿದ್ದು, ಆಸ್ಪತ್ರೆಯಿಂದ ಬಿಡುಗಡೆ ಹೊಂದಿದ್ದಾರೆ.",391,4,medium
"ಇಲ್ಲಿ 32 ಲಕ್ಷದ 19ಸಾವಿರಕ್ಕೂ ಹೆಚ್ಚು ಮಂದಿ ಸೋಂಕಿತರಿದ್ದು, 1 ಲಕ್ಷದ 35ಸಾವಿರಕ್ಕೂ ಹೆಚ್ಚು ಮಂದಿ ಮೃತಪಟ್ಟಿದ್ದಾರೆ.",391,4,medium
230 ಸದಸ್ಯ ಬಲದ ವಿಧಾನಸಭೆಯಲ್ಲಿ ಕಾಂಗ್ರೆಸ್‌ 114 ಮತ್ತು ಬಿಜೆಪಿ 107 ಸದಸ್ಯರನ್ನು ಹೊಂದಿವೆ.,391,4,medium
"ಘಟನೆಯಲ್ಲಿ ಎರಡು ಕಾರುಗಳು ನಜ್ಜುಗುಜ್ಜುಯಾಗಿದ್ದು, ಬೈಕ್ ಮತ್ತು ಕಾರಿನಲ್ಲಿದ್ದ ಹತ್ತು ಜನರಿಗೆ ಗಾಯವಾಗಿದೆ.",391,4,medium
ಅಗ್ನಿ ಅವಘಡದಲ್ಲಿ ಇದುವರೆಗೂ ಯಾವುದೇ ರೀತಿಯ ಸಾವು-ನೋವುಗಳು ಸಂಭವಿಸಿಲ್ಲ ಎಂದು ಅಧಿಕಾರಿಗಳು ಸ್ಪಷ್ಟಪಡಿಸಿದ್ದಾರೆ.,391,4,medium
ಇದು ವಿಶ್ವ ಆರೋಗ್ಯ ಸಂಸ್ಥೆಯಿಂದ ಕೋವಿಡ್ ಮತ್ತು ಭಾರತೀಯ ಹವಾಮಾನ ಇಲಾಖೆಯಿಂದ ತಾಪಮಾನ ದಾಖಲೆಯನ್ನು ಕಲೆ ಹಾಕಿತ್ತು.,391,4,medium
"ಹೊಸದಿಲ್ಲಿ: ಕಳೆದ ಒಂದು ವರ್ಷದಲ್ಲಿಆಲೂಗಡ್ಡೆಯ ಚಿಲ್ಲರೆ ಮಾರಾಟದ ದರವು 92% ಏರಿಕೆಯಾಗಿದ್ದರೆ, ಈರುಳ್ಳಿ ದರ 44% ಹೆಚ್ಚಿದೆ.",391,4,medium
ಈ ಹಿನ್ನೆಲೆ ಭಾರತೀಯ ಕೌನ್ಸಿಲ್ ಆಫ್ ಮೆಡಿಕಲ್ ರಿಸರ್ಚ್ (ಐಸಿಎಂಆರ್) ಈ ಬಗ್ಗೆ ತನಿಖೆ ಮಾಡುತ್ತಿದೆ.,391,4,medium
"ಈ ಪ್ರಕರಣದ ಆರೋಪಿಗಳ ಗುರುತು ಸಿಕ್ಕಿದ್ದು, ತಲೆಮರೆಸಿಕೊಂಡವರ ಪತ್ತೆಗೆ ಪೊಲೀಸರು ತನಿಖೆ ನಡೆಸುತ್ತಿದ್ದಾರೆ ಎಂದರು.",391,4,medium
ವಿದೇಶದಿಂದ ಬಂದವರಿಗೆ ತಪಾಸಣೆ ಬಳಿಕ 14 ದಿನ ಮನೆಯಲ್ಲೇ ಇರಲು ಸೂಚನೆ ನೀಡಲಾಗಿದೆ.,392,4,medium
ಕಾರ್ಮಿಕರಿಗೆ ಅಂಥ ಸಮಸ್ಯೆ ಇದ್ದರೆ ಕಾರ್ಮಿಕ ಆಯುಕ್ತರಿಗೆ ದೂರು ನೀಡಬಹುದಿತ್ತು ಅಥವಾ ಜಿಲ್ಲಾಧಿಕಾರಿಗೆ ದೂರು ನೀಡಬಹುದಿತ್ತು.,392,4,medium
ಮೈಸೂರು: ಬಹುನಿರೀಕ್ಷಿತ ಮೈಸೂರು ಹಾಗೂ ಚೆನ್ನೈ ನಡುವಿನ ಹೈಸ್ಪೀಡ್‌ ರೈಲ್ವೆ ಕಾರಿಡಾರ್‌ಗೆ 9 ನಿಲ್ದಾಣಗಳನ್ನು ಗುರುತಿಸಿದೆ.,392,4,medium
ಒಮ್ಮೆ ಬಳಸಿದ ಮಾಸ್ಕ್‌ನ್ನು ಐದು ದಿನಗಳವರೆಗೆ ಬಳಸಲು ಆಸ್ಪತ್ರೆ ಹೇಳಿದೆ ಎಂದು ಹೇಳಿದ್ದಾರೆ.,392,4,medium
ಮುಂಧ್‌ ಗ್ರಾಮದ ಕುಲದೀಪ್‌ ಎಂಬುವವರಿಗೆ ಸೇರಿದ ಎಮ್ಮೆ 18.94 ಲೀಟರ್‌ ಹಾಲು ನೀಡುವ ಮೂಲಕ ಎರಡನೇ ಪ್ರಶಸ್ತಿ ಪಡೆಯಿತು.,392,4,medium
"ಬಿಇ, ಬಿಟೆಕ್ ಪ್ರವೇಶಾತಿಗಾಗಿ ಜೆಇಇ ಮೇನ್ಸ್‌ 2020 ಪರೀಕ್ಷೆಯನ್ನು ಈ ವರ್ಷ ಎರಡು ಬಾರಿ ಕಂಪ್ಯೂಟರ್ ಆಧಾರಿತವಾಗಿ ನಡೆಸಲಾಯಿತು.",392,4,medium
ಹೊಟ್ಟೆಯಲ್ಲಿರುವ ಆಹಾರ ಮತ್ತು ಜೀರ್ಣರಸಗಳಲ್ಲಿರುವ ಆಮ್ಲಗಳು ಹಿಮ್ಮುಖವಾಗಿ ಅನ್ನನಾಳಕ್ಕೆ ಹಿಂದಿರುಗಿದಾಗ ಈ ಉರಿ ಎದುರಾಗುತ್ತದೆ.,392,4,medium
ಪ್ರಯಾಣಿಕರು ತಮ್ಮದೇ ಆದ ಆಹಾರ ಹಾಗೂ ಕುಡಿಯುವ ನೀರನ್ನು ತರಬೇಕು ಎಂದು ಕೇಂದ್ರ ಸರಕಾರ ಹೇಳಿದೆ.,392,4,medium
"ಈ ಮೂಲಕ ರಾಜ್ಯದಲ್ಲಿ ಒಟ್ಟು ಸೋಂಕಿತ ಪ್ರಕರಣಗಳ ಸಂಖ್ಯೆ 2,678 ಕ್ಕೆ ಏರಿಕೆಯಾಗಿದ್ದರೆ ಸಾವಿನ ಸಂಖ್ಯೆ 65ಕ್ಕೆ ಏರಿಕೆಯಾಗಿದೆ.",392,4,medium
"ಘಟನೆ ಸಂಬಂಧ ಈಗಾಗಲೇ ಐವರ ವಿರುದ್ಧ ಪೊಲೀಸರು ಎಫ್‌ಐಆರ್‌ ದಾಖಲಿಸಿಕೊಂಡಿದ್ದು, ತನಿಖೆ ಆರಂಭಿಸಿದ್ದಾರೆ.",392,4,medium
ಜೈಲಿಗೆ ಬರೋ ಮುನ್ನವೇ ಇವರನ್ನೆಲ್ಲಾ ಜೈಲಿನ ಹೊರ ಪ್ರದೇಶದಲ್ಲಿ 14 ದಿನ ಕ್ವಾರಂಟೈನ್‌ ಮಾಡಲಾಗಿತ್ತು.,393,4,medium
"ರಾಜ್ಯದ ಕರಾವಳಿ ತೀರದುದ್ದಕ್ಕೂ 45-55 ಕಿ. ಮೀ. ವೇಗದಲ್ಲಿ ಗಾಳಿ ಬೀಸುತ್ತಿದ್ದು, ಬಿರುಗಾಳಿಯ ವಾತಾವರಣ ಇರಲಿದೆ.",393,4,medium
ಸಾಮಾಜಿಕ ಅಂತರ ಕಾಯ್ದುಕೊಳ್ಳುವ ಉದ್ದೇಶದಿಂದ ಪ್ರತಿ ಬಸ್ಸಿನಲ್ಲಿ 30 ಮಂದಿಯ ಪ್ರಯಾಣಕ್ಕಷ್ಟೇ ಅನುಮತಿ ನೀಡಲಾಗಿತ್ತು.,393,4,medium
"ಪೆಟ್ರೋಲ್‌ ಬಂಕ್‌, ಕೆಲವು ಔಷಧ ಅಂಗಡಿಗಳು ಹಾಗೂ ಆಸ್ಪತ್ರೆ ಹೊರತುಪಡಿಸಿ ಉಳಿದೆಲ್ಲಸೇವೆಗಳು ಸ್ಥಗಿತವಾಗಿದ್ದವು.",393,4,medium
ಆದರೆ ಈ ಕುರಿತು ಇದುವರೆಗೂ ಕೇಂದ್ರ ಸರ್ಕಾರ ಯಾವುದೇ ಅಧಿಕೃತ ಹೇಳಿಕೆ ನೀಡಿಲ್ಲ.,393,4,medium
1816ರಲ್ಲಿ ನೇಪಾಳ ಹಾಗೂ ಬ್ರಿಟಿಷ್‌ ಇಂಡಿಯಾ ಮಾಡಿಕೊಂಡ ಸುಗೌಲಿ ಒಪ್ಪಂದದಂತೆ ಕಾಳಿ ನದಿಯ ಪಶ್ಚಿಮ ಪ್ರದೇಶ ಭಾರತದ್ದು ಎಂದು ಹೇಳಲಾಗಿದೆ.,393,4,medium
"ನಾನು ಮಾಡುತ್ತಿರುವ ಕೆಲಸ ನನಗೆ ಮಿಶ್ರ ಪ್ರತಿಕ್ರಿಯೆಗಳನ್ನು ತಂದುಕೊಟ್ಟಿದೆ, ಕೆಲವರು ನನ್ನನ್ನು ಇಷ್ಟಪಟ್ಟಿದ್ದಾರೆ, ಕೆಲವರು ಇಷ್ಟಪಟ್ಟಿಲ್ಲ.",393,4,medium
ಈ ಎರಡು ವರದಿಗಳು ಶೀಘ್ರದಲ್ಲೇ ಸಲ್ಲಿಕೆಯಾಗಲಿದೆ' ಎಂದು ಸಚಿವ ಡಾ. ಕೆ. ಸುಧಾಕರ್ ತಿಳಿಸಿದ್ದಾರೆ.,393,4,medium
ಪ್ರತಿಭಟನೆಯ ಸಂದರ್ಭದಲ್ಲಿಸಾಮಾಜಿಕ ಅಂತರ ಮರೆತು ಆಕ್ರೋಶಗೊಂಡ ಪ್ರತಿಭಟನಾಕರರನ್ನು ಚದುರಿಸಲು ಪೊಲೀಸರು ಹರಸಾಹಸ ಪಟ್ಟರು ಸಹ ಯಾವುದೇ ಪ್ರಯೋಜನವಾಗಲಿಲ್ಲ.,393,4,medium
ಅದೇ ಮನೆಯಲ್ಲಿದ್ದ ಮೃತರ ಅಳಿಯ ನಾಗರಾಜು(40) ಮತ್ತು ಮೊಮ್ಮಗಳು ಶ್ರೇಯ (7)ಗೆ ಸಣ್ಣಪುಟ್ಟ ಗಾಯಗಳಾಗಿವೆ.,393,4,medium
ಪೊಲೀಸ್ ಭದ್ರತೆನಗರದಲ್ಲಿ ಸುಮಾರು 5 ಸಾವಿರಕ್ಕೂ ಹೆಚ್ಚು ಪೊಲೀಸರು ಭದ್ರತೆಗೆ ನಿಯೋಜನೆ ಮಾಡಲಾಗಿದೆ.,394,4,medium
ಚೀನಾ ಹೊರತುಪಡಿಸಿ ಇತರೆ 26 ರಾಷ್ಟ್ರಗಳು ಹಾಗೂ ಪ್ರಾಂತ್ಯಗಳಿಗೂ ಕೊರೊನಾ ವೈರಸ್‌ ಹಬ್ಬಿದೆ.,394,4,medium
ಸಾಮಾಜಿಕ ಅಂತರ ಕಾಪಾಡಿಕೊಂಡು ಪರೀಕ್ಷೆ ಬರೆಯುವ ಸಲುವಾಗಿ ಪ್ರತಿ ಕೊಠಡಿಯಲ್ಲಿಕೇವಲ 12 ವಿದ್ಯಾರ್ಥಿಗಳಿಗೆ ವ್ಯವಸ್ಥೆ ಮಾಡಲಾಗಿತ್ತು.,394,4,medium
"ಮೂರು ಪ್ರಕರಣಗಳಲ್ಲಿ ಚಾರ್ಜ್‌ಶೀಟ್‌ ಸಲ್ಲಿಸಲು ನಮಗೆ ಅನುಮತಿ ನೀಡಲಾಗಿದ್ದು, ಇದರ ತನಿಖೆ ಮುಗಿದಿದೆ.",394,4,medium
ಯಾವುದೇ ಅಹಿತಕರ ಘಟನೆ ನಡೆಯದಂತೆ ನ್ಯಾಯಾಲಯದ ಆವರಣದಲ್ಲಿ ಬಿಗಿ ಪೊಲೀಸ್ ಬಂದೋಬಸ್ತ್ ಕಲ್ಪಿಸಲಾಗಿದೆ.,394,4,medium
"ಈ ದಿನ ಜನರು ಧನ್ವಂತರಿ ದೇವನನ್ನು, ಲಕ್ಷ್ಮಿ ದೇವಿಯನ್ನು ಪೂಜಿಸುತ್ತಾರೆ ಮತ್ತು ಯಮರಾಜನಿಗೆ ದೀಪವನ್ನು ಬೆಳಗುತ್ತಾರೆ.",394,4,medium
ಇತ್ತೀಚೆಗೆ ಕೇರಳದ ಕೋಳಿಕ್ಕೋಡ್‌ನ ವಿಮಾನ ನಿಲ್ಧಾಣದಲ್ಲಿ ವಿಮಾನ ಅವಘಡ ಸಂಭವಿಸಿ 18 ಮಂದಿ ಸಾವನಪ್ಪಿದ್ದರು.,394,4,medium
