source_data,batch_id,major_job_id,priority
View this post on Instagram A post shared by Rachita Ram (@rachita_instaofficial),394,4,medium
"ಈ ಕುರಿತು ಗುರುವಾರ ನಡೆದ ಕಾರ್ಯಕಾರಿಣಿ ಸಭೆಯಲ್ಲಿಈ ತೀರ್ಮಾನ ಕೈಗೊಳ್ಳಲಾಗಿದೆ,"" ಎಂದು ಹೇಳಿದರು.",394,4,medium
"ಠಾಕ್ರೆಗೆ ಚುನಾವಣೆಗೆ ಸ್ಪರ್ಧಿಸಲು ಆಗುತ್ತಿಲ್ಲ, ಕಾರಣ ಚುನಾವಣೆಯೇ ಮುಂದೂಡಿಕೆಯಾಗಿದೆ,"" ಎಂಬುದಾಗಿ ಅವರು ವಾದಿಸಿದ್ದಾರೆ.",394,4,medium
ಇದಾದ ನಂತರ ವಿಶ್ವ ಸಂಸ್ಥೆಯ ಭದ್ರತಾ ಮಂಡಳಿಯಲ್ಲಿ ಕಾಶ್ಮೀರ ಸಮಸ್ಯೆಯನ್ನು ಎತ್ತಲು ಚೀನಾ ಅನೇಕ ಪ್ರಯತ್ನಗಳನ್ನು ಮಾಡಿತ್ತು.,395,4,medium
ಮತದಾರರ ಪಟ್ಟಿಗೆ ಹೆಸರು ಸೇರ್ಪಡೆಗೊಳಿಸಲು 2021ರ ಜನವರಿ 1ಕ್ಕೆ 18 ವರ್ಷ ವಯಸ್ಸಾಗಿರಬೇಕು.,395,4,medium
ಆರಂಭದಲ್ಲಿ ಮುಂಗಾರು ಮಳೆ ದಕ್ಷಿಣ ಅಂಡಮಾನ್ ಸಮುದ್ರದತ್ತ ಬೀಸಿ ನಂತರ ಉತ್ತರಾಭಿಮುಖವಾಗಿ ಪಶ್ಚಿಮ ಭಾಗಕ್ಕೆ ಬಂಗಾಳ ಕೊಲ್ಲಿ ಮೂಲಕ ವಿಸ್ತಾರಗೊಳ್ಳಲಿದೆ.,395,4,medium
ಇನ್ನು ಇವರಿಬ್ಬರ ವಿರುದ್ಧ ದೆಹಲಿ ಹಾಗೂ ಪಂಜಾಬಿನಲ್ಲಿ ಹಲವು ಕೇಸ್‌ಗಳು ದಾಖಲಾಗಿತ್ತು ಎಂದು ದೆಹಲಿ ಪೊಲೀಸರು ಮಾಹಿತಿ ನೀಡಿದ್ದಾರೆ.,395,4,medium
"ದೇವರ ದಯೆ ಹಾಗೂ ನಿಮ್ಮೆಲ್ಲರ ಹಾರೈಕೆಯಿಂದ ಸದ್ಯ ಉತ್ತಮ ಸ್ಥಿತಿಯಲ್ಲಿದ್ದು, ಹಿಂದಿನ ದಿನಗಳಿಗಿಂತಲೂ ಸ್ಥಿರವಾಗಿದ್ದಾರೆ ಎಂದು ಹೇಳಿದ್ದಾರೆ.",395,4,medium
"ಇದೇ ವೇಳೆ ಸೋಮವಾರ 57 ಮಂದಿ ಆಸ್ಪತ್ರೆಯಿಂದ ಬಿಡುಗಡೆಗೊಂಡಿದ್ದು, ಈ ಮೂಲಕ 1548 ಮಂದಿ ಇದುವರೆಗೆ ಸೋಂಕಿನಿಂದ ಗುಣಮುಖರಾಗಿದ್ದಾರೆ.",395,4,medium
"ಈ ನಿಯಮ ಉಲ್ಲಂಘಿಸುವವರಿಗೆ 10,000 ಡಾಲರ್ ದಂಡ ಅಥವಾ ಆರು ತಿಂಗಳವರೆಗೆ ಜೈಲು ಅಥವಾ ಎರಡನ್ನೂ ವಿಧಿಸಲಾಗುತ್ತದೆ.",395,4,medium
View this post on Instagram A post shared by SanthoshAnanddramOfficial (@santhosh_ananddram),395,4,medium
"ರೈಲು ಹೊರಡುವ ಸಮಯದಿಂದ 24 ಗಂಟೆಗೂ ಮುಂಚೆಯೇ ಟಿಕೆಟ್‌ನ್ನು ರದ್ದುಪಡಿಸಲು ಅವಕಾಶ ನೀಡಲಾಗಿದ್ದು, ಶೇ.",395,4,medium
"ಅಲ್ಲದೆ, ಕೇವಲ ನಾಲ್ಕು ತಿಂಗಳಲ್ಲಿ ಅಯೋಧ್ಯೆಯಲ್ಲಿ ಮುಗಿಲೆತ್ತರದ ರಾಮ ಮಂದಿರವನ್ನು ನಿರ್ಮಿಸಲಾಗುವುದು ಎಂದು ಕೇಂದ್ರ ಗೃಹ ಸಚಿವ ಘೋಷಿಸಿದರು.",395,4,medium
ಈ ಪ್ರದೇಶದ ಜನರಿಗೆ ಹೊರಗೆ ಹೋಗಲು ಹಾಗೂ ಹೊರಗಿನವರಿಗೆ ಈ ವ್ಯಾಪ್ತಿಗೆ ಬರಲು ಅವಕಾಶವನ್ನು ನಿರಾಕರಿಸಲಾಗಿದೆ.,396,4,medium
ರಸ್ತೆಗಳಲ್ಲಿ ಬ್ಯಾರಿಕೇಡ್‌ ಅಳವಡಿಸುವ ಮೂಲಕ ಜನ ಹಾಗೂ ವಾಹನ ಸಂಚಾರಕ್ಕೆ ನಿರ್ಬಂಧ ಹೇರಲಾಗಿತ್ತು.,396,4,medium
ಈ ಮಧ್ಯೆ ಸಾಮಾಜಿಕ ಜಾಲತಾಣಗಳಲ್ಲಿ ಕೋವಿಡ್ 19 ಸೋಂಕಿಗೆ ಸಂಬಂಧಪಟ್ಟಂತೆ ಸಾಕಷ್ಟು ಸುಳ್ಳು ಸುದ್ದಿಗಳನ್ನು ಬಿತ್ತರಿಸಲಾಗುತ್ತಿದೆ.,396,4,medium
"ಈವರೆಗೆ ಜಿಲ್ಲೆಯಲ್ಲಿಒಟ್ಟು 21 ಕೋವಿಡ್‌ 19 ಪ್ರಕರಣ ಪತ್ತೆಯಾಗಿದ್ದು, 11 ಜನರು ಗುಣಮುಖರಾಗಿ ಬಿಡುಗಡೆಯಾಗಿದ್ದಾರೆ.",396,4,medium
ಪರೀಕ್ಷೆ ನಡೆಯುವ 1 ಗಂಟೆ 30 ನಿಮಿಷ ಮೊದಲೇ ವಿದ್ಯಾರ್ಥಿಗಳು ಪರೀಕಾ ಕೇಂದ್ರಗಳಲ್ಲಿಹಾಜರಿರಬೇಕು.,396,4,medium
"ಹಾಗಾಗಿ, ಇದೀಗ ಐಪಿಎಲ್‌ ಬಗ್ಗೆ ಯಾವುದೇ ನಿರ್ಧಾರ ತಿಳಿಸಲು ಸಾಧ್ಯವಿಲ್ಲ,"" ಎಂದು ಮೂಲಗಳು ಹೇಳಿವೆ.",396,4,medium
ಹೊಸದಿಲ್ಲಿ: ರಾಷ್ಟ್ರ ರಾಜಧಾನಿಯಲ್ಲಿ ಬುಧವಾರ ಮಧ್ಯರಾತ್ರಿಯಿಂದ ಸುರಿದ ಭಾರೀ ಮಳೆಗೆ ರಸ್ತೆಗಳೆಲ್ಲ ನದಿಯಾಗಿ ಬದಲಾದ ಸನ್ನಿವೇಶ ಸೃಷ್ಟಿಯಾಯಿತು.,396,4,medium
﻿KTET Exam 2020: ಕರ್ನಾಟಕ ಶಿಕ್ಷಕರ ಅರ್ಹತಾ ಪರೀಕ್ಷೆಗೆ ಮತ್ತೊಮ್ಮೆ ದಿನಾಂಕ ಬದಲಾವಣೆ,396,4,medium
"ವೇದ್‌ಪ್ರಕಾಶ್ ಪ್ರಕಾರ, ಘಟನೆಯ ಬಗ್ಗೆ ತನಿಖೆ ನಡೆಯುತ್ತಿದ್ದು, ಪ್ರಕರಣ ದಾಖಲಿಸಲಾಗುತ್ತದೆ ಎಂದು ಹೇಳಿದ್ದಾರೆ.",396,4,medium
"ಅಪರಾಧಿ, ದಂಡ ಕಟ್ಟದಿದ್ದರೆ ಮತ್ತೆ 6 ತಿಂಗಳು ಸಾದಾ ಶಿಕ್ಷೆ ಅನುಭವಿಸುವಂತೆ ನ್ಯಾಯಾಧೀಶರು ಆದೇಶಿಸಿದ್ದಾರೆ.",396,4,medium
"''ಭಾರತ ನಾನಾ ಭಾಷೆ, ಆಚಾರ-ವಿಚಾರ, ಸಂಸ್ಕೃತಿಯನ್ನು ಹೊಂದಿರುವ, ವಿವಿಧತೆಯಲ್ಲಿ ಏಕತೆಯನ್ನು ಪ್ರತಿಪಾದಿಸಿಕೊಂಡು ಬಂದಿರುವ ದೇಶವಾಗಿದೆ.",397,4,high
ಸ್ತ್ರೀರೋಗ ತಜ್ಞರನ್ನು ಭೇಟಿ ಮಾಡಿದ ಬಳಿಕ ಸರಿಯಾದ ಔಷಧಿ ತೆಗೆದುಕೊಳ್ಳಿ ಮತ್ತು ಸ್ವಲ್ಪ ಸಮಯ ಲೈಂಗಿಕ ಕ್ರಿಯೆಯಿಂದ ದೂರವಿರಿ.,397,4,high
ಕಳೆದ ಒಂದು ತಿಂಗಳಲ್ಲಿ ರೋಗಿಗಳಿಗೆ ಚಿಕಿತ್ಸೆ ನೀಡುವ ಆರೋಗ್ಯ ಸೌಲಭ್ಯಗಳು 3.5 ಪಟ್ಟು ಹೆಚ್ಚಾಗಿದೆ.,397,4,high
"ಈ ಮಾದರಿಗಳನ್ನು ಭಾರತದ ವಿವಿಧ ರಾಜ್ಯಗಳಿಂದ ಅಂದರೆ ಕರ್ನಾಟಕ, ಮಹಾರಾಷ್ಟ್ರ, ದೆಹಲಿ, ಮಧ್ಯಪ್ರದೇಶ ಮತ್ತು ಒಡಿಶಾದಿಂದ ಪಡೆಯಲಾಗಿದೆ.",397,4,high
ಫೋನ್‌ ಕರೆಗಳು ಹಾಗೂ ಸಿಸಿ ಟಿವಿ ದೃಶ್ಯಗಳನ್ನು ಪರಿಶೀಲಿಸಿದ ಪೊಲೀಸರು ಆರೋಪಿಗಳನ್ನು ಬಂಧಿಸಿದ್ದಾರೆ.,397,4,high
ಅಂದಿನಿಂದ ಇಂದಿನವರೆಗೂ ಇಲ್ಲಿ ಬೇರೆ ಯಾವ ಚಿತ್ರಕ್ಕೂ ಚಿತ್ರೀಕರಣ ಮಾಡಲು ಅನುಮತಿ ನೀಡಿರಲಿಲ್ಲ.,397,4,high
"A post shared by Mukesh Khanna (@iammukeshkhanna) on Oct 26, 2020 at 10:54pm PDT",397,4,high
ಪಾಲಿಸಿಸ್ಟಿಕ್ ಒವೆರಿ ಡಿಸಾರ್ಡರ್(ಪಿಸಿಒಡಿ) ಮತ್ತು ಪಾಲಿಸಿಸ್ಟಿಕ್ ಒವೆರಿ ಸಿಂಡ್ರೋಮ್ ಮಹಿಳೆಯರಲ್ಲಿ ಋತುಚಕ್ರವು ವಿಳಂಬವಾಗಲು ಅಥವಾ ಆಗದೆ ಇರಲು ಪ್ರಮುಖ ಕಾರಣವಾಗಿದೆ.,397,4,high
ಬರಾನಿ ಖಲ್ಸಾದ ವಿಜೇಂದರ್‌ ಚೌಹಾಣ್‌ ಮಾಲೀಕತ್ವದ ಹಸು 58.17 ಲೀಟರ್‌ ಹಾಲು ಹಿಂಡುವ ಮೂಲಕ ಎರಡನೇ ಪ್ರಶಸ್ತಿ ಪಡೆಯಿತು.,397,4,high
ನಾವೂ ಪ್ರಾಣ ಕಳೆದುಕೊಳ್ಳುತ್ತೇವೆ ಎಂಬ ಭೀತಿ ಆವರಿಸಿತ್ತು'' ಎಂದು ಅಶೋಕ ನಗರದ ನಿವಾಸಿ ರಾಜೇಶ್‌ ಖಾತ್ರಿ ಹೇಳಿದರು.,397,4,high
"ಇದಕ್ಕೆ ಹಲವು ಕಾರಣಗಳಿವೆ,"" ಎಂದು ಸ್ಪೋರ್ಟ್ಸ್‌ ಸ್ಕ್ರೀನ್‌ ಯೂಟ್ಯೂಬ್‌ ಕಾರ್ಯಕ್ರಮದಲ್ಲಿ ಜೋನ್ಸ್‌ ಹೇಳಿದ್ದಾರೆ.",398,4,high
"ಅದೇ ಕಾಲಕ್ಕೆ ನಾವು, ಸುಧಾರಣೆಗೋಸ್ಕರ ಯಾವುದೇ ಹೊಸ ವಿಚಾರಗಳನ್ನು ಸ್ವೀಕರಿಸಲು ಕೂಡ ಸಿದ್ಧರಿದ್ದೇವೆ.",398,4,high
ಮಹಾರಾಷ್ಟ್ರ ಹೊರತುಪಡಿಸಿ ಬೇರೆ ರಾಜ್ಯಗಳಿಂದ ಬರುವ ಜನರಿಗೆ 14 ದಿನಗಳ ಹೋಮ್‌ ಕ್ವಾರಂಟೈನ್‌ಗೆ ಒಳಪಡಿಸಲಾಗುತ್ತದೆ.,398,4,high
ಯಾವ ದಿಕ್ಕಿನಲ್ಲಿ ಮಲಗಬೇಕುಸರಿಯಾದ ಸಂಬಂಧ ಹೊಂದಿರಲು ಮತ್ತು ಉತ್ತಮ ಲೈಂಗಿಕ ಸಂಬಂಧಕ್ಕಾಗಿ ದಂಪತಿಗಳು ಆಗ್ನೇಯ ದಿಕ್ಕಿನಲ್ಲಿ ಮಲಗಬೇಕು.,398,4,high
ಸಾಮಾಜಿಕ ಅಂತರ ಕಾಯ್ದುಕೊಳ್ಳಲು ಒಂದು ಬಸ್ಸಿನಲ್ಲಿಕೇವಲ 30 ಜನರಿಗೆ ಮಾತ್ರ ಪ್ರಯಾಣಕ್ಕೆ ಅವಕಾಶ ನೀಡಲಾಗಿದೆ.,398,4,high
"ವಿಶೇಷವಾಗಿ ಈ ಸಮಯದಲ್ಲಿ, ಅವರು ದಿನದ ಯಾವುದೇ ಸಮಯಕ್ಕಿಂತ ಹೆಚ್ಚಿನ ಗಮನ ಕೊಡಬೇಕೆಂದು ಹಂಬಲಿಸುತ್ತಾರೆ.",398,4,high
"2017 ರ ಅಧ್ಯಯನದ ಪ್ರಕಾರ, ಪೊಟ್ಯಾಷಿಯಂ ಪೂರಕಗಳು ಅಧಿಕ ರಕ್ತದೊತ್ತಡವಿರುವ ವ್ಯಕ್ತಿಗಳಲ್ಲಿ ರಕ್ತದೊತ್ತಡ ಕದಿಮೆ ಮಾಡಲು ನೆರವಾಗುತ್ತದೆ.",398,4,high
"ಹಾಗೆಯೇ ಜುಲೈ 31ರ ವೇಳೆಗೆ ಹೊರಗಿನವರು ಸೇರಿದಂತೆ 1.5 ಲಕ್ಷ ಹಾಸಿಗೆಗಳು ಬೇಕಾಗುತ್ತದೆ"" ಎಂದು ಸೇರಿಸಿದರು.",398,4,high
"10 ವರ್ಷದ ಒಳಗಿನ ಮಕ್ಕಳಿಗೆ ಹಾಗೂ 65 ವರ್ಷ ಮೇಲ್ಪಟ್ಟವರಿಗೆ, ಗರ್ಭಿಣಿಯರಿಗೆ ಪ್ರವೇಶವಿಲ್ಲ.",398,4,high
"ಗುಜರಾತ್‌: 5 ವರ್ಷದ ಮಗಳನ್ನು ಅತ್ಯಾಚಾರಗೈದ ಯುವಕನನ್ನು ಕೊಂದ ತಂದೆ, ಖಾಸಗಿ ಭಾಗಕ್ಕೆ ತುಳಿದು ಹತ್ಯೆ!",398,4,high
"ಬೀದರ್‌ನ ಮೂವರು ಈ ಹಿಂದಿನ ರೋಗಿಗಳ ಸಂಪರ್ಕಿತರಾಗಿದ್ದರೆ, ಒಬ್ಬರಿಗೆ ಮುಂಬಯಿಗೆ ಪ್ರಯಾಣ ಬೆಳೆಸಿರುವ ಹಿನ್ನೆಲೆ ಇದೆ.",399,4,high
"​ದೈಹಿಕ ಕಾರಣಗಳುಕ್ಯಾನ್ಸರ್, ಮಧುಮೇಹ, ಕಿಡ್ನಿ ದೌರ್ಬಲ್ಯ, ಮೂತ್ರಕೋಶದ ಸಮಸ್ಯೆ ಅಥವಾ ಹೃದಯ ಸಂಬಂಧಿ ಕಾಯಿಲೆಗಳು ಲೈಂಗಿಕ ದೌರ್ಬಲ್ಯವನ್ನು ಉಂಟು ಮಾಡುವುದು.",399,4,high
ನಟ ಸುಶಾಂತ್ ಸಿಂಗ್ ರಜಪೂತ್ ಆತ್ಮಹತ್ಯೆ ಪ್ರಕರಣದ ತನಿಖೆಯನ್ನು ಮುಂಬೈ ಪೊಲೀಸರು ಚುರುಕುಗೊಳಿಸಿದ್ದಾರೆ.,399,4,high
ಆಗ ನ್ಯಾಯಾಲಯ ಆನಂದ್‌ಸಿಂಗ್‌ ಹಾಜರಾತಿಗೆ 10 ದಿನಗಳ ಕಾಲಾವಕಾಶ ನೀಡಿ ವಿಚಾರಣೆಯನ್ನು ಫೆ.,399,4,high
"ಯಡಿಯೂರಪ್ಪ, ಮಹಾರಾಷ್ಟ್ರ ಸಿಎಂ ಉದ್ಧವ್ ಠಾಕ್ರೆ, ಉತ್ತರಪ್ರದೇಶ ಸಿಎಂ ಯೋಗಿ ಆದಿತ್ಯನಾಥ್ ಹಾಗೂ ಪಂಜಾಬ್ ಸಿಎಂ ಕ್ಯಾ.",399,4,high
ಹಾರ್ಮೋನ್ ಅಸಮತೋಲನದಿಂದಾಗಿ ಗರ್ಭಕೋಶದಲ್ಲಿ ಚೀಲಗಳು ನಿರ್ಮಾಣವಾದ ವೇಳೆ ಪಿಸಿಒಎಸ್ ಮತ್ತು ಪಿಸಿಒಡಿಯು ಕಂಡುಬರುವುದು.,399,4,high
"ಜಿಲ್ಲೆಯಲ್ಲಿ ಈವರೆಗೆ 41 ಕೋವಿಡ್‌ ಪ್ರಕರಣ ದೃಢಪಟ್ಟಿದ್ದು, ಈ ಪೈಕಿ 21 ಜನರು ಗುಣಮುಖರಾಗಿ ಆಸ್ಪತ್ರೆಯಿಂದ ಬಿಡುಗಡೆ ಹೊಂದಿದ್ದಾರೆ.",399,4,high
ದೇವಾಲಯದ ನವೀಕರಣ ಕಾರ್ಯದಲ್ಲಿ ತೊಡಗಿದ್ದ ಕಾರ್ಮಿಕರಿಗೆ ಅಮ್ಮನ್ ಸನ್ನತಿ ಬಳಿ ನಾಣ್ಯಗಳಿರುವ ತಾಮ್ರದ ಪಾತ್ರೆ ಸಿಕ್ಕಿದೆ.,399,4,high
"ರಾಸಾಯನಿಕ ವಸ್ತುಗಳಿಗೆ ಚೀನಾದ ಮೇಲಿನ ಅವಲಂಬನೆ ತಗ್ಗಿಸಲು ಕೇಂದ್ರದಿಂದ 25,000 ಕೋಟಿ ರೂ.",399,4,high
ಇವರಿಗೆ ಅವರ ಮನೆಗಳಲ್ಲಿಪ್ರತ್ಯೇಕ ಕೋಣೆಯಲ್ಲಿರಿಸಿ 14 ದಿನಗಳವರೆಗೆ ನಿಗಾ ವಹಿಸಲಾಗುತ್ತದೆ' ಎಂದು ಜಿಲ್ಲಾಧಿಕಾರಿ ಕ್ಯಾ.,399,4,high
"ಪ್ರಯಾಣಿಕರನ್ನು ಇಳಿಸಿದ ಬಳಿಕ ವಿಮಾನ ನಿಲ್ದಾಣದಲ್ಲಿ ಹಣ ವರ್ಗಾವಣೆ, ಸಿಮ್ ವಿತರಣೆ, ಆರೋಗ್ಯ ಕಿಟ್ ವಿತರಣೆ, ಉಪಹಾರ ವ್ಯವಸ್ಥೆ ಮಾಡಲಾಯಿತು.",400,4,high
ಕಳೆದ ಕೇವಲ 15 ದಿನಗಳಲ್ಲಿ ದೇಶದಲ್ಲಿ 10 ಲಕ್ಷ ಹೊಸ ಪ್ರಕರಣಗಳು ವರದಿಯಾಗಿರುವುದು ಆತಂಕ ಹೆಚ್ಚಿಸಿದೆ.,400,4,high
ಬಿಹಾರ ವಿಧಾನಸಭಾ ಚುನಾವಣೆಗೆ ತನ್ನ ಪಾಲಿನ ಎಲ್ಲ 115 ಕ್ಷೇತ್ರಗಳಿಗೆ ಜೆಡಿಯು ಬುಧವಾರ ಅಭ್ಯರ್ಥಿಗಳನ್ನು ಘೋಷಿಸಿತ್ತು.,400,4,high
"ಬಿಜೆಪಿಗೆ ಕೇವಲ 10 ರಿಂದ 14 ಸೀಟುಗಳು ಮಾತ್ರ ಒಲಿಯಲಿದ್ದು, ಎರಡನೇ ಸ್ಥಾನಕ್ಕೆ ತೃಪ್ತಿಪಟ್ಟು ಕೊಳ್ಳಬೇಕಾ­ಗುತ್ತದೆ.",400,4,high
ಲೈಂಗಿಕತೆಯ ನಂತರ ಮಾತನಾಡುವ ಜನರು ಇತರರಿಗಿಂತ ಹೆಚ್ಚು ಪರಾಕಾಷ್ಠೆಯನ್ನು ಹೊಂದಿರುತ್ತಾರೆ ಎಂದು ಅಧ್ಯಯನಗಳು ಸೂಚಿಸಿವೆ.,400,4,high
ಬೆಳಗ್ಗೆ 7 ಗಂಟೆಗೆ ಆರಂಭವಾಗುವ ಸಂಚಾರ ಸಂಜೆ 7 ಗಂಟೆಗೆ ಬಂದ್‌ ಆಗುತ್ತದೆ.,400,4,high
"A post shared by CHANDAN KUMAR ���� (@chandan_kumar_official) on Oct 7, 2020 at 3:16am PDT",400,4,high
ತುರ್ತು ಪರಿಸ್ಥಿತಿಗಾಗಿ ಬಾಡಿಗೆ ತೆಗೆದುಕೊಂಡಿರುವುದನ್ನು ಹೊರತುಪಡಿಸಿ ಟ್ಯಾಕ್ಸಿಗಳು ಮತ್ತು ಕ್ಯಾಬ್‌ ಚಾಲನೆ ನಿಷೇಧಿಸಲಾಗಿದೆ.,400,4,high
ಇನ್ನು ಇದೆ ವೇಳೆ ಉತ್ತರ ಪ್ರದೇಶ ಮುಖ್ಯಮಂತ್ರಿ ಯೋಗಿ ಆದಿತ್ಯನಾಥ್‌ ಘಟನೆ ಬಗ್ಗೆ ವಿಷಾದ ವ್ಯಕ್ತಪಡಿಸಿದ್ದಾರೆ.,400,4,high
ಪಕ್ಷದ ಮೂಲಗಳ ಪ್ರಕಾರ ಶಾಸಕರ ಪತ್ನಿಯರ ಮೂಲಕ ಬೆಂಗಳೂರಿನಲ್ಲಿರುವ ಶಾಸಕರನ್ನು ಸಂಪರ್ಕಿಸಲು ಯತ್ನಿಸಲಾಗಿದೆ.,400,4,high
"ಈವರೆಗೆ ಒಟ್ಟು 232 ಸೋಂಕಿತರು ಗುಣಮುಖರಾಗಿದ್ದರೆ, 82 ಸಕ್ರಿಯ ರೋಗಿಗಳು ಚಿಕಿತ್ಸೆ ಪಡೆಯುತ್ತಿದ್ದಾರೆ.",401,4,low
"ಜಿಲ್ಲೆಯಲ್ಲಿಈವರೆಗೆ 23 ಪ್ರಕರಣಗಳು ವರದಿಯಾಗಿದ್ದು, ಈ ಪೈಕಿ 21 ಜನರು ಗುಣಮುಖರಾಗಿ ಆಸ್ಪತ್ರೆಯಿಂದ ಬಿಡುಗಡೆಯಾಗಿದ್ದಾರೆ.",401,4,low
ಕೊರೊನಾ ಕಾರಣದಿಂದ ಈ ವರ್ಷ 90 ಸಾವಿರ ಮಕ್ಕಳು ಸರಕಾರಿ ಶಾಲೆಗಳಿಗೆ ಸೇರ್ಪಡೆಯಾಗಿದ್ದಾರೆ.,401,4,low
"ಮಾರ್ಚ್ 6ರಂದು ಚುನಾವಣಾ ಅಧಿಸೂಚನೆ ಪ್ರಕಟವಾಗಲಿದ್ದು, ನಾಮಪತ್ರ ಸಲ್ಲಿಕೆಗೆ ಮಾರ್ಚ್ 13 ಕೊನೆಯ ದಿನವಾಗಿದೆ.",401,4,low
"ಘಟನೆ ಸಂಬಂಧ ಮಾಹಿತಿ ಸಿಕ್ಕಿದಂತೆ, ಪೊಲೀಸರು ಹಾಗೂ ಅಗ್ನಿಶಾಮಕ ದಳದ ಸಿಬ್ಬಂದಿ ಸ್ಥಳಕ್ಕೆ ಧಾವಿಸಿ ಬೆಂಕಿ ನಂದಿಸಲು ಪ್ರಯತ್ನಿಸಿದ್ದಾರೆ.",401,4,low
"ಜನರು ಮಾಸ್ಕ್‌ ಧರಿಸುವಿಕೆ, ಸಾಮಾಜಿಕ ಅಂತರ ಕಾಪಾಡುವಿಕೆ ಹಾಗೂ ಆಗಾಗ ಕೈ ತೊಳೆಯುವುದನ್ನು ಮರೆಯಬಾರದು.",401,4,low
"ಬಾಯ್ ಫ್ರೆಂಡ್ ಜೀನ್ಸ್ನೀವು ಕ್ಯಾಷುಯಲ್ ಮತ್ತು ಆರಾಮದಾಯಕ ಜೀನ್ಸ್ ಧರಿಸಲು ಬಯಸುವವರಾದರೆ, ನೀವು ಬಾಯ್ ಫ್ರೆಂಡ್ ಜೀನ್ಸ್ ಪ್ರಯತ್ನಿಸಬಹುದು.",401,4,low
ದರ್ಶನಕ್ಕೆ ಬರುವ ಭಕ್ತರು ಮಾಸ್ಕ್‌ ಧರಿಸುವುದು ಮತ್ತು ಸಾಮಾಜಿಕ ಅಂತರ ಕಾಯ್ದುಕೊಳ್ಳುವುದು ಕಡ್ಡಾಯವಾಗಿದೆ.,401,4,low
ಆರೋಪಿಗಳನ್ನು ಹೆಚ್ಚಿನ ವಿಚಾರಣೆಗೆ ನ್ಯಾಯಾಲಯ 7 ದಿನಗಳ ಕಾಲ ಪೊಲೀಸ್ ಕಸ್ಟಡಿಗೆ ಒಪ್ಪಿಸಲಾಗಿದೆ.,401,4,low
"ತೀವ್ರ ಜ್ವರದ ಪ್ರಾರಂಭ, ನೆಗಡಿ, ಕೆಮ್ಮು, ಭೇದಿಯಾಗಿ ಉಸಿರಾಟ ದಲ್ಲಿ ತೊಂದರೆ ಕಾಣಿಸುವುದು ರೋಗದ ಲಕ್ಷಣವಾಗಿದೆ.",401,4,low
To read in english click: Common reasons why sex can be painful?,402,4,low
''ತೀವ್ರತರ ಸೋಂಕು ತಗುಲಿದ ವ್ಯಕ್ತಿಗಳು ಅಥವಾ ಸಾವಿಗೀಡಾದ ವ್ಯಕ್ತಿಗಳು 60 ವರ್ಷಕ್ಕಿಂತ ಮೇಲ್ಪಟ್ಟವರೇ ಆಗಿದ್ದಾರೆ.,402,4,low
"ಅದರ ಬಗ್ಗೆ ತನಿಖೆ ನಡೆಯು ತ್ತಿದೆ'', ಎಂದು ಬೆಳಗಾವಿಯ ಹಿರಿಯ ಅಧಿಕಾರಿಯೊಬ್ಬರು ತಿಳಿಸಿ ದರು.",402,4,low
"137 ಜನ ಸೋಂಕಿನಿಂದ ಈವರೆಗೆ ಗುಣಮುಖರಾಗಿ ಬಿಡುಗಡೆ ಹೊಂದಿದ್ದು, 159 ಪ್ರಕರಣಗಳು ಸಕ್ರಿಯವಾಗಿವೆ.",402,4,low
ಹೊಸದಿಲ್ಲಿ: ಕೇಂದ್ರೀಯ ಪ್ರೌಢಶಿಕ್ಷಣ ಮಂಡಳಿ (ಸಿಬಿಎಸ್‌ಇ) 2019-20ನೇ ಶೈಕ್ಷಣಿಕ ವರ್ಷದ 10ನೇ ತರಗತಿಯ ಪರೀಕ್ಷೆಗಳ ಫಲಿತಾಂಶವನ್ನು ಬುಧವಾರ ಪ್ರಕಟಿಸಿದೆ.,402,4,low
"ಜಿಎಸ್‌ಟಿ ಅನುಷ್ಠಾನದಲ್ಲಿಉಂಟಾಗುವ ನಷ್ಟವನ್ನು ಸರಿದೂಗಿಸಲು ರಾಜ್ಯಗಳಿಗೆ ಕೇಂದ್ರ ಹಣಕಾಸು ಸಚಿವಾಲಯ 8ನೇ ಕಂತಿನ ಪರಿಹಾರವಾಗಿ 6,000 ಕೋಟಿ ರೂ.",402,4,low
"ಜಿಲ್ಲೆಯಲ್ಲಿ ಈವರೆಗಿನ 133 ಸೋಂಕಿತರ ಪೈಕಿ 61 ಮಂದಿ ಗುಣಮುಖರಾಗಿದ್ದರೆ, 67 ರೋಗಿಗಳು ಚಿಕಿತ್ಸೆ ಪಡೆಯುತ್ತಿದ್ದಾರೆ.",402,4,low
ನಮಗೆ ಅವರಿಂದ ಉತ್ತಮ ಸ್ಪಂದನೆ ಸಿಗುವ ಸಾಧ್ಯತೆ ಇದೆ' ಎಂದು ಶಿವರಾಜ್‌ಕುಮಾರ್ ಹೇಳಿದ್ದಾರೆ.,402,4,low
ಬೇರೆ ಯಾವುದೇ ರಾಜ್ಯಗಳ ಪೊಲೀಸರು ಕೂಡ ಇಷ್ಟು ಅಸಹಕಾರ ತೋರಿದ್ದನ್ನು ನಾನು ನೋಡಿಲ್ಲ.,402,4,low
"ಅಲ್ಲಿಯ ಹೊತ್ತಿಗೆ ಎಲ್ಲವೂ ಸರಿ ಹೋಗಿರುತ್ತದೆ ಎಂಬ ಆಶಾ ಭಾವದಲ್ಲಿದ್ದೇವೆ,"" ಎಂದು ವಿವರಿಸಿದ್ದಾರೆ.",402,4,low
ಇದರ ಚಿತ್ರೀಕರಣದ ವೇಳೆ ಸೆಟ್‌ನಲ್ಲಿ ಇದ್ದ ಯಾರೋ ಒಬ್ಬರು ವಿಡಿಯೋ ರೆಕಾರ್ಡ್‌ ಮಾಡಿಕೊಂಡು ಸಾಮಾಜಿಕ ಜಾಲತಾಣದಲ್ಲಿ ಹರಿಬಿಟ್ಟಿದ್ದಾರೆ.,403,4,low
"ಇವರೆಲ್ಲರಿಗೂ ನಿಗದಿಪಡಿಸಿದ ಕೋವಿಡ್-19 ಆಸ್ಪತ್ರೆಯಲ್ಲಿ ಚಿಕಿತ್ಸೆ ನೀಡಲಾಗುತ್ತಿದ್ದು, ಅವರ ಆರೋಗ್ಯ ಸ್ಥಿತಿಯು ಸ್ಥಿರವಾಗಿದೆ.",403,4,low
"ಕೃತ್ಯಕ್ಕೆ ಬಳಸಿದ್ದ 3ಮೊಬೈಲ್‌ ಫೋನ್‌, ಒಂದು ಲಾರಿ, ಒಂದು ಇಂಡಿಕಾ ಕಾರನ್ನೂ ವಶಪಡಿಸಿಕೊಳ್ಳಲಾಗಿದೆ.",403,4,low
"ಇಂದಿನವರೆಗೆ 2259 ಜನರು ಸೋಂಕಿನಿಂದ ಗುಣಮುಖರಾಗಿ ಬಿಡುಗಡೆ ಹೊಂದಿದ್ದಾರೆ, 85 ಜನರು ಮೃತಪಟ್ಟಿದ್ದಾರೆ.",403,4,low
'ಮಿಠಾಯಿ ಮನೆ' ಚಿತ್ರಕ್ಕೆ ಉತ್ತಮ ಮಕ್ಕಳ ಚಿತ್ರ ಎಂಬ ವಿಭಾಗದಲ್ಲಿ ಕರ್ನಾಟಕ ರಾಜ್ಯ ಪ್ರಶಸ್ತಿ ಸಂದಿದೆ.,403,4,low
ಗ್ರಾಮ ಪಂಚಾಯಿತಿ ಮಟ್ಟದಲ್ಲಿ ಪಂಚಾಯತ್‌ ಅಭಿವೃದ್ಧಿ ಅಧಿಕಾರಿಯವರನ್ನು ಜನನ ಮರಣ ಪ್ರಮಾಣ ಪತ್ರಗಳ ವಿತರಣಾಧಿಕಾರಿಗಳನ್ನಾಗಿ ನೇಮಸಿ ಸರ್ಕಾರ ಆದೇಶಿಸಿದೆ.,403,4,low
ಅವರ ನಿವಾಸದಲ್ಲಿ ಕುತ್ತಿಗೆಗೆ ನೇಣು ಬಿಗಿದಿದ್ದ ಸ್ಥಿತಿಯಲ್ಲಿ ಸೋಮವಾರ ರಾತ್ರಿ ಶವ ಪತ್ತೆಯಾಗಿದೆ.,403,4,low
42 ಜಿಲ್ಲೆಗಳಲ್ಲಿ ಕಳೆದ 28 ದಿನಗಳಲ್ಲಿ ಯಾವುದೇ ಪಾಸಿಟಿವ್‌ ಪ್ರಕರಣಗಳು ಕಂಡು ಬಂದಿಲ್ಲ ಎಂಬುದಾಗಿ ಅವರು ವಿವರಿಸಿದ್ದಾರೆ.,403,4,low
"ಹೊಸದಿಲ್ಲಿಯಲ್ಲಿ ಅಕ್ಟೋಬರ್‌ ತಿಂಗಳಿನಲ್ಲಿ ಸರಾಸರಿ 17.2 ಡಿಗ್ರಿ ಸೆಲ್ಸಿಯಸ್‌ ತಾಪಮಾನ ದಾಖಲಾಗಿದ್ದು, ಇದು 58 ವರ್ಷಗಳಲ್ಲೇ ಅತ್ಯಂತ ಕನಿಷ್ಠ ತಾಪಮಾನವಾಗಿದೆ.",403,4,low
ಮೃತರ ಕುಟುಂಬಕ್ಕೆ ಸಾಂತ್ವಾನ ಹೇಳಿದ ಸಿಎಂ ಬಿಎಸ್‌ವೈ ತಲಾ ಐದು ಲಕ್ಷ ರೂಪಾಯಿ ಪರಿಹಾರ ಘೋಷಿಸಿದ್ದಾರೆ.,403,4,low
ಮಾರ್ಚ್‌ 31ರವರೆಗೆ ಖಾಸಗಿ ಸೇರಿ ಎಲ್ಲಾ ಪ್ರಾಥಮಿಕ ಶಾಲೆಗಳಿಗೆ ರಜೆ ಘೋಷಿಸುತ್ತೇವೆ ಎಂದು ದೆಹಲಿ ಉಪಮುಖ್ಯಮಂತ್ರಿ ಮನೀಶ್‌ ಸಿಸೋಡಿಯಾ ಹೇಳಿದ್ದಾರೆ.,404,4,low
"ಇದು ಭೋಪಾಲ್, ಇಂದೋರ್, ದೆಹಲಿ, ಕೋಲ್ಕತಾ ಮತ್ತು ಮುಂಬೈ ಮುಂತಾದ ಪ್ರಮುಖ ನಗರಗಳೊಂದಿಗೆ ಉತ್ತಮ ಸಂಪರ್ಕ ಹೊಂದಿದೆ.",404,4,low
"ವಿಶಾಖಪಟ್ಟಣವನ್ನು ಕಾರ್ಯಾಂಗ ರಾಜಧಾನಿ, ಅಮರಾವತಿಯನ್ನು ಶಾಸಕಾಂಗ ರಾಜಧಾನಿ ಮತ್ತು ಕರ್ನೂಲ್‌ ಅನ್ನು ಶಾಸಕಾಂಗ ರಾಜಧಾನಿಯಾಗಿ ಅಭಿವೃದ್ಧಿಪಡಿಸುವುದು ಜಗನ್‌ ಸರಕಾರದ ಉದ್ದೇಶವಾಗಿದೆ.",404,4,low
ಸದ್ಯ 12 ರಲ್ಲಿ 8 ಜನರು ಡಿಸ್ಚಾರ್ಜ್‌ ಆಗಿದ್ದು ನಾಲ್ವರು ಆಸ್ಪತ್ರೆಯಲ್ಲಿ ಚಿಕಿತ್ಸೆ ಪಡೆಯುತ್ತಿದ್ದಾರೆ.,404,4,low
